[
  {
    "id": "message_email-01",
    "primary_type": "message_email",
    "split": "development",
    "language": "zh",
    "length_profile": "medium",
    "prompt": "把这封给合作场馆的邮件整理得清楚、坦诚，可调整段落；保留全部安排、条件与尚未确定事项。只返回邮件正文，不加主题。",
    "source_text": "陈老师，您好。上次电话后我们又核了一遍六月工作坊的人数和空间，我想先把现在能确认的部分发给您，免得两边分别在排。报名表里有二十四个人，其中四个人说可能晚到，但我们没有答应为迟到者单独重讲。我们希望使用二楼东侧教室，日期是6月18日，时间14:00到17:00，上午布置不在这次申请里。如果那个教室不能借，我们也可以考虑一楼的小厅，不过需要先看照片才能判断投影位置，不能现在就确认小厅。设备方面，我们自带电脑和一只转接头，请场馆提供投影仪与二十六把椅子。茶水可以由大家自己带，不必请您安排。\n费用现在有一个容易误会的地方：去年的报价不能直接沿用。我们的项目预算上限是1800元，这个数字包含场地和设备使用，但不是请您一定按这个价接；如果正常报价超过了，也请按实际情况告诉我，我们再回去调整内容。财务还在确认能否接受电子普通发票，周五之前不一定有答复。没确认前，烦请不要替我们开票，也不要先替我们垫付。\n另外，报名页上写的“适合第一次尝试的人”是说内容门槛，不是保证每个人都能完成作品。授课老师希望保留这个区别。您若方便，能否在本周四17:00前告知教室是否可用、场地与设备的分项报价，以及是否需要另签安全告知书？如果您需要更长时间核实，先告诉我预计回复的日子也可以。收到这些信息后，我们才能发出最终场地确认。谢谢您前面帮忙看场地。"
  },
  {
    "id": "message_email-02",
    "primary_type": "message_email",
    "split": "development",
    "language": "en",
    "length_profile": "medium",
    "prompt": "Rewrite this email to a university lab coordinator. Make the two requests easy to find and preserve the limits on what I can promise. Return the email body only.",
    "source_text": "Dear Morgan,\nI have been going back through the notes from our visit, and there are two things on which I still need your help before I can make a plan for the students. We are bringing twelve visiting students on 9 July, with arrival at 10:30 and departure at noon. They have all completed our own introductory safety session. I understand that this does not replace your laboratory induction. Could you tell me whether the local induction can take place within that visiting window, and whether there is anything the students need to read before they arrive? We can ask them to read material in advance, but I cannot certify that they have passed your induction.\nThe other issue is access. Two students have asked whether the route from the north entrance to the demonstration room involves stairs. They have not shared medical details with me, and I do not want to ask them for those in an email that goes to the whole group. If you have a description of that route, or a contact who can discuss access privately, please send it to me. Please do not copy the student group into that discussion at this stage.\nWe had hoped to see the imaging equipment while it was running. If that is not possible on the day, a demonstration with the equipment switched off would still be useful. There is no need to arrange a special live run just for us. I will collect questions from the students beforehand, although I cannot promise that every student will send one. If possible, please reply by 2 July so I can send a single practical note to the group. Thank you for helping us prepare."
  },
  {
    "id": "message_email-03",
    "primary_type": "message_email",
    "split": "development",
    "language": "zh",
    "length_profile": "short",
    "prompt": "仅把第二句改得不催逼，其他字句和换行不要动。返回完整消息。",
    "source_text": "小陆，初稿已发你邮箱。你今天必须看完，不然我没法往下做。若今天来不及，告诉我你方便反馈的时间。"
  },
  {
    "id": "message_email-04",
    "primary_type": "message_email",
    "split": "development",
    "language": "zh",
    "length_profile": "short",
    "prompt": "只校对错字和标点，不润色；输出校对后的短信。",
    "source_text": "阿姨，我到南站了，正在等公交。车票和药都带齐了，您别担心。我到了在给您打电话。"
  },
  {
    "id": "message_email-05",
    "primary_type": "message_email",
    "split": "development",
    "language": "zh",
    "length_profile": "short",
    "prompt": "只检查错别字。没有错误就逐字返回原消息，不加说明。",
    "source_text": "小齐，明天我可以从14点值班到16点。16点以后我不能继续值班，请在那之前安排好交接。谢谢。"
  },
  {
    "id": "message_email-06",
    "primary_type": "message_email",
    "split": "development",
    "language": "en",
    "length_profile": "short",
    "prompt": "Use the record to reply to a customer asking when their refund will arrive. Do not guess an arrival date. If it cannot be confirmed, say so in the reply and offer only a next step supported by the record. Return the reply only.",
    "source_text": "The ticket was submitted to finance for review on Tuesday. Customer support can check whether the review is complete. Finance has not provided a processing time, and the refund has not yet been initiated."
  },
  {
    "id": "message_email-07",
    "primary_type": "message_email",
    "split": "development",
    "language": "zh",
    "length_profile": "short",
    "prompt": "改写成给同事的自然消息。引用、工单号和链接保持原样，只返回消息。",
    "source_text": "关于 TKT-093，我已经看过页面。文档原话是“未收到回执不代表提交失败”。我建议先看 https://help.example.org/forms?lang=zh#receipt ，不要直接重复提交。我还没核对后台日志。"
  },
  {
    "id": "message_email-08",
    "primary_type": "message_email",
    "split": "development",
    "language": "en",
    "length_profile": "short",
    "prompt": "Make this decline less stiff, but do not imply I am free on another date. Return one message.",
    "source_text": "Thank you for inviting me to join the panel on 16 August. Due to an existing commitment, I will not be able to participate. I am not currently able to suggest an alternative speaker."
  },
  {
    "id": "message_email-09",
    "primary_type": "message_email",
    "split": "development",
    "language": "zh",
    "length_profile": "short",
    "prompt": "把这些便签写成发给邻居的短消息，不责备，也不把观察写成定论。",
    "source_text": "昨晚大约22点，家里听见持续敲击声，感觉来自楼上，但没确认。明早孩子有考试，想请对方今晚若有施工，尽量20点前结束。如果声音不是他家发出的，也请告知。"
  },
  {
    "id": "message_email-10",
    "primary_type": "message_email",
    "split": "development",
    "language": "zh",
    "length_profile": "short",
    "prompt": "为这封给供应商的邮件修正语病，不改变责任边界；主题行和签名原样保留。",
    "source_text": "主题：补件核对 / PO-117\n林经理，三件样品中有一件缺少底座。我们尚未确认是漏装还是运输中遗失，请先协助核对出库照片。并不是所有样品都不能使用。\n周凝｜采购支持"
  },
  {
    "id": "status_notice-01",
    "primary_type": "status_notice",
    "split": "development",
    "language": "zh",
    "length_profile": "medium",
    "prompt": "将这份交接记录整理为给值班主管的工作汇报，分清已完成、风险和需要决定的事。不要添加截止承诺。只返回汇报。",
    "source_text": "昨天夜班我们做的是冷库温度记录的补录，不是温控设备维修。A区的纸质记录共有三十六张，已经录入三十四张；另外两张上的时间看不清，留在异常夹，没有按相邻记录推算。B区有一张记录写着“低于下限”，但没有温度数字，我们只录了原文，没有填入最低温度。录入表已放到共享盘，文件名是 coldroom-log-r3.csv，表里空值表示原纸缺少可辨认数字，并不表示零度。\n设备方面，凌晨两点值班员看到B区显示屏短暂熄灭，约一分钟后自行亮起。我们没有连续录像，也没有拆机，不能据此说制冷系统停过。那一分钟里没有人工测温数据。早班已经知道这件事，但还没有确认是否安排技术人员到场。为了不让补录进度和设备状态混为一谈，我想在汇报里分别写。\n今天白班可以继续核对剩下两张纸，也可以先扫描整批原件，但只有一名同事能操作扫描仪。扫描会让纸张核对往后排，目前没法保证两项今天都完成。请主管决定先核哪一项。若选择先扫描，需要保留两张模糊原件，不能因为有扫描件就把原纸清掉。\n还有一个交接细节：共享盘里上周的 r2 文件没有删除，是为了保留追溯；本轮工作也没有改变库内货物的放行状态。出货仍由当班负责人按原流程判断，录入人员无权凭这张补录表批准出货。我的建议是先把显示屏异常登记给设备组，由他们判断检查范围；这个建议还没有得到批准。"
  },
  {
    "id": "status_notice-02",
    "primary_type": "status_notice",
    "split": "development",
    "language": "en",
    "length_profile": "medium",
    "prompt": "Turn these notes into a notice for volunteers. Keep the fallback conditional and make the practical choices easy to see. Return the notice only.",
    "source_text": "The riverside book exchange is planned for Saturday, 20 April, from 11:00 to 15:00. Volunteers should arrive at the west gate at 10:15, where Nia will distribute table assignments. We have permission to use the covered walkway if the ground is wet, but that space holds only four tables rather than the six planned for the lawn. This does not mean the exchange is cancelled whenever it rains. Nia will check the site at 09:00 and post the location in the volunteer chat. People should use that message rather than assume that the previous evening's weather forecast has settled the choice.\nDonated books will be accepted until 13:00. The exchange itself will remain open until 15:00. We cannot take magazines or books with visible mould, and volunteers should explain that without criticising the donor. Unsuitable items must stay with the donor; we have not arranged a disposal service. Books that remain at the end can be offered to the neighbourhood reading room only after its coordinator has agreed. That agreement has not yet been received.\nThere will be a short briefing beside the west gate before setup begins. Anyone who cannot lift boxes can help with sorting or the information table. Volunteers do not need to explain why they prefer those tasks. Please ask people to tell Nia by Thursday evening if they will be absent or arrive late, so she can adjust assignments. We do not have a replacement waiting for every role. The event page is https://example.org/exchange/april and should be included without changing its address."
  },
  {
    "id": "status_notice-03",
    "primary_type": "status_notice",
    "split": "development",
    "language": "zh",
    "length_profile": "short",
    "prompt": "只修改【风险】这一行，消除歧义，其他内容逐字保留。",
    "source_text": "【进展】已完成18份合同的编号核对。\n【风险】剩余两份不一定今天不能完成，要看对方是否补齐附件。\n【下一步】收到附件后再核对金额。"
  },
  {
    "id": "status_notice-04",
    "primary_type": "status_notice",
    "split": "development",
    "language": "zh",
    "length_profile": "short",
    "prompt": "只校对通知中的错别字，不改措辞。",
    "source_text": "阅览室本周三上午闭馆，下午13:00恢复开放。已借图书的到期日不受影向。自助还书箱照常使用。"
  },
  {
    "id": "status_notice-05",
    "primary_type": "status_notice",
    "split": "development",
    "language": "zh",
    "length_profile": "short",
    "prompt": "只校对。原文无误就逐字返回，不加说明。",
    "source_text": "电梯将于周二08:00至09:00检修，楼梯照常开放。如需在这段时间内使用无台阶通道，请在来访前联系前台。"
  },
  {
    "id": "status_notice-06",
    "primary_type": "status_notice",
    "split": "development",
    "language": "en",
    "length_profile": "short",
    "prompt": "Use these notes to write a short project-channel update. Do not invent a cause or a recovery time. Return the update only.",
    "source_text": "Since 11:20, some test accounts have been unable to export reports. Production accounts were not included in this check, so their status is unknown. Investigation has started; the cause is not confirmed. The next status update is scheduled for 12:00."
  },
  {
    "id": "status_notice-07",
    "primary_type": "status_notice",
    "split": "development",
    "language": "zh",
    "length_profile": "short",
    "prompt": "润色成面向住户的通知。编号、引用及网址原样保留。",